{
  "schemaVersion": "0.5.0",
  "campaignId": "last-mile-reference",
  "visibility": "server_only",
  "status": "review",
  "policyProfileId": "SINGLE_PLAYER_REFERENCE",
  "mapId": "last-mile-map-2",
  "startNodeId": "N00",
  "entrySteps": [
    {
      "kind": "route",
      "routeId": "R00",
      "fromFraction": 0,
      "toFraction": 1
    }
  ],
  "firstSceneId": "E1",
  "initialFlags": {
    "manifestPending": false,
    "inspectionPending": false,
    "bridgeRefused": false
  },
  "scenes": [
    {
      "sceneId": "E1",
      "nodeId": "N01",
      "title": "西门：登记与绕行",
      "intro": "车队抵达西门。岗亭正在处理出入登记，南侧服务路也可前往市集。",
      "topicIds": [
        "gate_status",
        "manifest",
        "roads"
      ],
      "backgroundIds": [
        "BG01",
        "BG02",
        "BG03",
        "BG04",
        "BG05"
      ],
      "actionIds": [
        "E1_MAIN",
        "E1_BYPASS"
      ]
    },
    {
      "sceneId": "E2",
      "nodeId": "N02",
      "title": "市集：谁在重复谁",
      "intro": "前方传来爆响，关于白色皮卡的说法迅速传播。当前主路是否可通行仍不明确。",
      "topicIds": [
        "cause",
        "roads"
      ],
      "backgroundIds": [
        "BG01",
        "BG02",
        "BG03",
        "BG04",
        "BG05"
      ],
      "actionIds": [
        "E2_MAIN",
        "E2_BYPASS"
      ]
    },
    {
      "sceneId": "E3",
      "nodeId": "N05",
      "title": "主桥：看起来完整",
      "intro": "车队到达河西。主桥与旧河床便道通向接收站，现场管理状态需要判断。",
      "topicIds": [
        "bridge_status",
        "ford_status",
        "manifest",
        "roads"
      ],
      "backgroundIds": [
        "BG01",
        "BG02",
        "BG03",
        "BG04",
        "BG05"
      ],
      "actionIds": [
        "E3_BRIDGE",
        "E3_FORD"
      ]
    }
  ],
  "approvedBackgrounds": [
    {
      "backgroundId": "BG01",
      "title": "卫星时效",
      "text": "卫星图像的拍摄时刻可能早于获取时刻；历史畅通不能证明当前畅通。",
      "validity": "fictional_general_guidance_not_current_truth"
    },
    {
      "backgroundId": "BG02",
      "title": "传闻独立性",
      "text": "不同转述者可能引用同一位原始讲述人，来源数量不等于独立观察数量。",
      "validity": "fictional_general_guidance_not_current_truth"
    },
    {
      "backgroundId": "BG03",
      "title": "表面与许可",
      "text": "可见桥面连续不等于当前车辆通行许可。要区分可见结构、管理状态和车型限制。",
      "validity": "fictional_general_guidance_not_current_truth"
    },
    {
      "backgroundId": "BG04",
      "title": "信息边界",
      "text": "你的输入中未自动包含指挥官的累计用时、乘员状态和资源余额；必要时请询问而不要估计。",
      "validity": "fictional_general_guidance_not_current_truth"
    },
    {
      "backgroundId": "BG05",
      "title": "有限观察",
      "text": "一次无人机观察覆盖特定地点与时刻，不应泛化为整条路线永久安全。",
      "validity": "fictional_general_guidance_not_current_truth"
    }
  ],
  "cases": [
    {
      "privateCaseId": "A",
      "truth": {
        "gateElectronicOnline": true,
        "marketLaneOpen": false,
        "bridgeVehicleAllowed": true,
        "explosionCause": "unconfirmed_equipment_incident",
        "medicalFatalityAuthored": false
      },
      "evidenceDefinitions": [
        {
          "definitionId": "gate_layout",
          "sceneId": "E1",
          "sourceRole": "analyst",
          "channel": "initial",
          "acquisition": "preloaded",
          "topicId": "roads",
          "priority": 50,
          "title": "路口与服务路",
          "body": "地图显示主路穿过西门，服务路经南侧弯道到达市集。地图不能证明检查系统正在运行。",
          "statementKind": "brief",
          "sourceLabel": "地形简报",
          "observationScope": "路口与服务路",
          "observationAgeMs": null,
          "provenanceStatus": "partially_verified",
          "hiddenRootId": "direct_gate_layout",
          "traceCostChannel": null,
          "traceResult": null
        },
        {
          "definitionId": "gate_operator",
          "sceneId": "E1",
          "sourceRole": "analyst",
          "channel": "initial",
          "acquisition": "preloaded",
          "topicId": "gate_status",
          "priority": 20,
          "title": "岗亭无线电摘录",
          "body": "值守员转述：“今天应该仍可电子核验。”记录没有确认设备在线状态。",
          "statementKind": "testimony",
          "sourceLabel": "值守无线电摘录",
          "observationScope": "岗亭无线电摘录",
          "observationAgeMs": null,
          "provenanceStatus": "unverified",
          "hiddenRootId": "gate_desk",
          "traceCostChannel": null,
          "traceResult": null
        },
        {
          "definitionId": "gate_papers",
          "sceneId": "E1",
          "sourceRole": "liaison",
          "channel": "initial",
          "acquisition": "preloaded",
          "topicId": "manifest",
          "priority": 50,
          "title": "登记资料",
          "body": "车队有20人名单。主门提供身份登记；绕行后需要在转运区补录，抵达不等于交接手续完成。",
          "statementKind": "brief",
          "sourceLabel": "任务联络简报",
          "observationScope": "登记资料",
          "observationAgeMs": null,
          "provenanceStatus": "partially_verified",
          "hiddenRootId": "direct_gate_papers",
          "traceCostChannel": null,
          "traceResult": null
        },
        {
          "definitionId": "gate_queue",
          "sceneId": "E1",
          "sourceRole": "liaison",
          "channel": "initial",
          "acquisition": "preloaded",
          "topicId": "gate_status",
          "priority": 20,
          "title": "旧排队消息",
          "body": "清晨有人说主门排队较长，但没有给出当前等待时间。",
          "statementKind": "testimony",
          "sourceLabel": "清晨接报",
          "observationScope": "旧排队消息",
          "observationAgeMs": null,
          "provenanceStatus": "unverified",
          "hiddenRootId": "gate_queue",
          "traceCostChannel": "witness",
          "traceResult": {
            "title": "来源核验：旧排队消息",
            "body": "追问确认：来源说明了自己的观察范围或登记身份。核实来源只确认传播链，不自动证明内容全部正确。",
            "status": "partially_verified",
            "rootLabel": "清晨接报已说明来源",
            "relatedDefinitionIds": [
              "gate_queue"
            ]
          }
        },
        {
          "definitionId": "gate_satellite",
          "sceneId": "E1",
          "sourceRole": "analyst",
          "channel": "satellite",
          "acquisition": "investigation",
          "topicId": "roads",
          "priority": 20,
          "title": "西门历史图像",
          "body": "十分钟前路面无车辆堵塞。图像无法识别电子登记系统是否可用。",
          "statementKind": "observation",
          "sourceLabel": "卫星历史帧",
          "observationScope": "西门历史图像",
          "observationAgeMs": 600000,
          "provenanceStatus": "partially_verified",
          "hiddenRootId": "direct_gate_satellite",
          "traceCostChannel": null,
          "traceResult": null
        },
        {
          "definitionId": "gate_drone",
          "sceneId": "E1",
          "sourceRole": "analyst",
          "channel": "drone",
          "acquisition": "investigation",
          "topicId": "gate_status",
          "priority": 20,
          "title": "岗亭实时画面",
          "body": "岗亭屏幕亮起，车辆逐一通过登记口；画面不能读出名单核验结果。",
          "statementKind": "observation",
          "sourceLabel": "无人机实时观察",
          "observationScope": "岗亭实时画面",
          "observationAgeMs": null,
          "provenanceStatus": "partially_verified",
          "hiddenRootId": "direct_gate_drone",
          "traceCostChannel": null,
          "traceResult": null
        },
        {
          "definitionId": "gate_agency",
          "sceneId": "E1",
          "sourceRole": "liaison",
          "channel": "localAgency",
          "acquisition": "investigation",
          "topicId": "gate_status",
          "priority": 20,
          "title": "西门办公室答复",
          "body": "值班员确认电子登记在线，20人名单可用现有流程核对。",
          "statementKind": "testimony",
          "sourceLabel": "西门登记办公室",
          "observationScope": "西门办公室答复",
          "observationAgeMs": null,
          "provenanceStatus": "unverified",
          "hiddenRootId": "gate_desk",
          "traceCostChannel": "localAgency",
          "traceResult": {
            "title": "来源核验：西门办公室答复",
            "body": "追问确认：来源说明了自己的观察范围或登记身份。核实来源只确认传播链，不自动证明内容全部正确。",
            "status": "partially_verified",
            "rootLabel": "西门登记办公室已说明来源",
            "relatedDefinitionIds": [
              "gate_operator",
              "gate_agency"
            ]
          }
        },
        {
          "definitionId": "gate_witness",
          "sceneId": "E1",
          "sourceRole": "liaison",
          "channel": "witness",
          "acquisition": "investigation",
          "topicId": "gate_status",
          "priority": 20,
          "title": "刚离开的司机",
          "body": "司机称刚完成电子核验，约几十秒通过；不同车队可能需要额外检查。",
          "statementKind": "testimony",
          "sourceLabel": "现场司机",
          "observationScope": "刚离开的司机",
          "observationAgeMs": null,
          "provenanceStatus": "unverified",
          "hiddenRootId": "gate_driver",
          "traceCostChannel": "witness",
          "traceResult": {
            "title": "来源核验：刚离开的司机",
            "body": "追问确认：来源说明了自己的观察范围或登记身份。核实来源只确认传播链，不自动证明内容全部正确。",
            "status": "partially_verified",
            "rootLabel": "现场司机已说明来源",
            "relatedDefinitionIds": [
              "gate_witness"
            ]
          }
        },
        {
          "definitionId": "service_drone",
          "sceneId": "E1",
          "sourceRole": "analyst",
          "channel": "drone",
          "acquisition": "investigation",
          "topicId": "roads",
          "priority": 20,
          "title": "服务路车道",
          "body": "服务路连续可通行，路面狭窄。无法核实是否已完成人员登记。",
          "statementKind": "observation",
          "sourceLabel": "无人机服务路观察",
          "observationScope": "服务路车道",
          "observationAgeMs": null,
          "provenanceStatus": "partially_verified",
          "hiddenRootId": "direct_service_drone",
          "traceCostChannel": null,
          "traceResult": null
        },
        {
          "definitionId": "market_map",
          "sceneId": "E2",
          "sourceRole": "analyst",
          "channel": "initial",
          "acquisition": "preloaded",
          "topicId": "roads",
          "priority": 50,
          "title": "市集道路",